{
  "$schema": "https://rmside.invalid/schemas/xs-builtin-catalog/v1",
  "schemaVersion": "1.1.0",
  "compatibility": {
    "minimumMajor": 1,
    "maximumMajor": 1
  },
  "catalogId": "aoe2de-xs-builtins-v1",
  "builds": [
    {
      "id": "4x",
      "productVersion": "101.103.48987"
    },
    {
      "id": "5x",
      "productVersion": "101.103.54800"
    },
    {
      "id": "57257",
      "productVersion": "101.103.57257"
    }
  ],
  "runtimes": [
    {
      "id": "rms",
      "description": "Scripts loaded by #includeXS from a random map script."
    },
    {
      "id": "trigger",
      "description": "Scenario trigger scripts."
    },
    {
      "id": "ai",
      "description": "AI scripts."
    }
  ],
  "builtins": [
    {
      "name": "abs",
      "category": "language-library",
      "builds": [
        "4x",
        "5x",
        "57257"
      ],
      "runtimes": [
        "ai",
        "rms",
        "trigger"
      ],
      "returnType": "float",
      "parameters": [
        {
          "name": "x",
          "type": "float"
        }
      ],
      "summary": "Absolute value.",
      "basis": "signature"
    },
    {
      "name": "acos",
      "category": "language-library",
      "builds": [
        "4x",
        "5x",
        "57257"
      ],
      "runtimes": [
        "ai",
        "rms",
        "trigger"
      ],
      "returnType": "float",
      "parameters": [
        {
          "name": "x",
          "type": "float"
        }
      ],
      "summary": "Arc cosine, in radians.",
      "basis": "signature"
    },
    {
      "name": "asin",
      "category": "language-library",
      "builds": [
        "4x",
        "5x",
        "57257"
      ],
      "runtimes": [
        "ai",
        "rms",
        "trigger"
      ],
      "returnType": "float",
      "parameters": [
        {
          "name": "x",
          "type": "float"
        }
      ],
      "summary": "Arc sine, in radians.",
      "basis": "signature"
    },
    {
      "name": "atan",
      "category": "language-library",
      "builds": [
        "4x",
        "5x",
        "57257"
      ],
      "runtimes": [
        "ai",
        "rms",
        "trigger"
      ],
      "returnType": "float",
      "parameters": [
        {
          "name": "x",
          "type": "float"
        }
      ],
      "summary": "Arc tangent, in radians.",
      "basis": "signature"
    },
    {
      "name": "atan2",
      "category": "language-library",
      "builds": [
        "4x",
        "5x",
        "57257"
      ],
      "runtimes": [
        "ai",
        "rms",
        "trigger"
      ],
      "returnType": "float",
      "parameters": [
        {
          "name": "y",
          "type": "float"
        },
        {
          "name": "x",
          "type": "float"
        }
      ],
      "summary": "Angle of the point (x, y) from the origin, in radians.",
      "basis": "signature"
    },
    {
      "name": "atan2v",
      "category": "language-library",
      "builds": [
        "4x",
        "5x",
        "57257"
      ],
      "runtimes": [
        "ai",
        "rms",
        "trigger"
      ],
      "returnType": "float",
      "parameters": [
        {
          "name": "v",
          "type": "vector"
        }
      ],
      "summary": "Angle of a vector's x/y direction, in radians.",
      "basis": "signature"
    },
    {
      "name": "bin",
      "category": "language-library",
      "builds": [
        "5x",
        "57257"
      ],
      "runtimes": [
        "ai",
        "rms",
        "trigger"
      ],
      "returnType": "int",
      "parameters": [
        {
          "name": "str",
          "type": "string"
        },
        {
          "name": "defaultValue",
          "type": "int",
          "default": -1
        }
      ],
      "summary": "Parses a binary number from a string, or returns the fallback value.",
      "basis": "signature"
    },
    {
      "name": "bitAnd",
      "category": "language-library",
      "builds": [
        "4x",
        "5x",
        "57257"
      ],
      "runtimes": [
        "ai",
        "rms",
        "trigger"
      ],
      "returnType": "int",
      "parameters": [
        {
          "name": "v1",
          "type": "int",
          "default": -1
        },
        {
          "name": "v2",
          "type": "int",
          "default": -1
        }
      ],
      "summary": "Bitwise AND of two integers.",
      "basis": "signature"
    },
    {
      "name": "bitCastToFloat",
      "category": "language-library",
      "builds": [
        "4x",
        "5x",
        "57257"
      ],
      "runtimes": [
        "ai",
        "rms",
        "trigger"
      ],
      "returnType": "float",
      "parameters": [
        {
          "name": "number",
          "type": "int",
          "default": 0
        }
      ],
      "summary": "Reinterprets the bits of an integer as a float.",
      "basis": "signature"
    },
    {
      "name": "bitCastToInt",
      "category": "language-library",
      "builds": [
        "4x",
        "5x",
        "57257"
      ],
      "runtimes": [
        "ai",
        "rms",
        "trigger"
      ],
      "returnType": "int",
      "parameters": [
        {
          "name": "number",
          "type": "float"
        }
      ],
      "summary": "Reinterprets the bits of a float as an integer.",
      "basis": "signature"
    },
    {
      "name": "bitLsh",
      "category": "language-library",
      "builds": [
        "5x",
        "57257"
      ],
      "runtimes": [
        "ai",
        "rms",
        "trigger"
      ],
      "returnType": "int",
      "parameters": [
        {
          "name": "v1",
          "type": "int",
          "default": -1
        },
        {
          "name": "v2",
          "type": "int",
          "default": -1
        }
      ],
      "summary": "Shifts an integer left by a number of bits.",
      "basis": "signature"
    },
    {
      "name": "bitNot",
      "category": "language-library",
      "builds": [
        "4x",
        "5x",
        "57257"
      ],
      "runtimes": [
        "ai",
        "rms",
        "trigger"
      ],
      "returnType": "int",
      "parameters": [
        {
          "name": "v1",
          "type": "int",
          "default": -1
        }
      ],
      "summary": "Bitwise complement of an integer.",
      "basis": "signature"
    },
    {
      "name": "bitOr",
      "category": "language-library",
      "builds": [
        "4x",
        "5x",
        "57257"
      ],
      "runtimes": [
        "ai",
        "rms",
        "trigger"
      ],
      "returnType": "int",
      "parameters": [
        {
          "name": "v1",
          "type": "int",
          "default": -1
        },
        {
          "name": "v2",
          "type": "int",
          "default": -1
        }
      ],
      "summary": "Bitwise OR of two integers.",
      "basis": "signature"
    },
    {
      "name": "bitRsh",
      "category": "language-library",
      "builds": [
        "5x",
        "57257"
      ],
      "runtimes": [
        "ai",
        "rms",
        "trigger"
      ],
      "returnType": "int",
      "parameters": [
        {
          "name": "v1",
          "type": "int",
          "default": -1
        },
        {
          "name": "v2",
          "type": "int",
          "default": -1
        }
      ],
      "summary": "Shifts an integer right by a number of bits.",
      "basis": "signature"
    },
    {
      "name": "bitXor",
      "category": "language-library",
      "builds": [
        "4x",
        "5x",
        "57257"
      ],
      "runtimes": [
        "ai",
        "rms",
        "trigger"
      ],
      "returnType": "int",
      "parameters": [
        {
          "name": "v1",
          "type": "int",
          "default": -1
        },
        {
          "name": "v2",
          "type": "int",
          "default": -1
        }
      ],
      "summary": "Bitwise exclusive OR of two integers.",
      "basis": "signature"
    },
    {
      "name": "ceil",
      "category": "language-library",
      "builds": [
        "4x",
        "5x",
        "57257"
      ],
      "runtimes": [
        "ai",
        "rms",
        "trigger"
      ],
      "returnType": "float",
      "parameters": [
        {
          "name": "x",
          "type": "float"
        }
      ],
      "summary": "Smallest whole number not below x, as a float.",
      "basis": "signature"
    },
    {
      "name": "chr",
      "category": "language-library",
      "builds": [
        "5x",
        "57257"
      ],
      "runtimes": [
        "ai",
        "rms",
        "trigger"
      ],
      "returnType": "string",
      "parameters": [
        {
          "name": "code",
          "type": "int",
          "default": 0
        }
      ],
      "summary": "A one-character string for a character code.",
      "basis": "signature"
    },
    {
      "name": "cos",
      "category": "language-library",
      "builds": [
        "4x",
        "5x",
        "57257"
      ],
      "runtimes": [
        "ai",
        "rms",
        "trigger"
      ],
      "returnType": "float",
      "parameters": [
        {
          "name": "x",
          "type": "float"
        }
      ],
      "summary": "Cosine of an angle in radians.",
      "basis": "signature"
    },
    {
      "name": "degrees",
      "category": "language-library",
      "builds": [
        "4x",
        "5x",
        "57257"
      ],
      "runtimes": [
        "ai",
        "rms",
        "trigger"
      ],
      "returnType": "float",
      "parameters": [
        {
          "name": "x",
          "type": "float"
        }
      ],
      "summary": "Converts radians to degrees.",
      "basis": "signature"
    },
    {
      "name": "dist",
      "category": "language-library",
      "builds": [
        "4x",
        "5x",
        "57257"
      ],
      "runtimes": [
        "ai",
        "rms",